<?xml version='1.0' encoding='utf-8'?>
<!DOCTYPE list SYSTEM "config.dtd">
<list>

	<char>
		<PlayerID set="268481576"/>
		<IsGM set="true"/>
		<CanUseGMCommand set="true"/>
		<CanAnnounce set="true"/>
		<CanBan set="true"/>
		<CanBanChat set="true"/>
		<CanUnBanChat set="true"/>
		<BanChatDelay set="-1"/>
		<BanChatMaxValue set="-1"/>
		<BanChatCountPerDay set="-1"/>
		<BanChatBonusId set="-1"/>
		<BanChatBonusCount set="-1"/>
		<CanChatPenalty set="true"/>
		<UseGMShop set="true"/>
		<CanDelete set="true"/>
		<CanKick set="true"/>
		<Menu set="true"/>
		<GodMode set="true"/>
		<CanEditCharAll set="true"/>
		<CanEditChar set="true"/>
		<CanEditPledge set="true"/>
		<CanViewChar set="true"/>
		<CanEditNPC set="true"/>
		<CanViewNPC set="true"/>
		<CanTeleport set="true"/>
		<CanRestart set="true"/>
		<MonsterRace set="true"/>
		<Rider set="true"/>
		<FastUnstuck set="true"/>
		<ResurectFixed set="true"/>
		<Door set="true"/>
		<Res set="true"/>
		<PeaceAttack set="true"/>
		<Heal set="true"/>
		<Unblock set="true"/>
		<CanChangeClass set="true"/>
		<BlockInventory set="false"/>
		<CanGmEdit set="true"/>
		<IsEventGm set="true"/>
		<CanReload set="true"/>
		<CanRename set="true"/>
		<CanJail set="true"/>
		<CanPolymorph set="true"/>
		<UseInventory set="true"/>
		<UseTrade set="true"/>
		<CanAttack set="true"/>
		<CanEvaluate set="true"/>
		<CanJoinParty set="true"/>
		<CanJoinClan set="true"/>
		<UseWarehouse set="true"/>
		<UseShop set="true"/>
	</char>
</list>