<?xml version='1.0' encoding='utf-8'?>
<!DOCTYPE list SYSTEM "config.dtd">
<list>
	<char>
		<PlayerID set="-1"/>
		<IsGM set="true"/>
		<CanTeleport set="true"/>
		<GodMode set="true"/>
		<CanUseGMCommand set="true"/>
		<CanTeleport set="true"/>
		<FastUnstuck set="true"/>
		<ResurectFixed set="true"/>
		<Door set="true"/>
		<PeaceAttack set="false"/>
		<UseTrade set="false"/>
		<CanAttack set="false"/>
		<CanJoinClan set="false"/>
		<BlockInventory set="true"/>
		<CanViewChar set="false"/>
	</char>
</list>